
    =========================== USB Port2 ===========================

Connection Status        : 0x01 (Device is connected)
Port Chain               : 2-1-2
Properties               : 0x01
 IsUserConnectable       : yes
 PortIsDebugCapable      : no
 PortHasMultiCompanions  : no
 PortConnectorIsTypeC    : no

      ======================== USB Device ========================

        +++++++++++++++++ Device Information ++++++++++++++++++
Device Description       : Xbox 360 Controller for Windows
Device Path              : \\?\usb#vid_15e4&pid_3f00#3048e1e4#{a5dcbf10-6530-11d2-901f-00c04fb951ed}
Device ID                : USB\VID_15E4&PID_3F00\3048E1E4
Hardware IDs             : USB\VID_15E4&PID_3F00&REV_0100 USB\VID_15E4&PID_3F00
Driver KeyName           : {d61ca365-5af4-4486-998b-9db4734c6ca3}\0000 ({D61CA365-5AF4-4486-998B-9DB4734C6CA3})
Driver                   : \SystemRoot\System32\drivers\xusb22.sys (Version:   Date: )
Driver Inf               : C:\WINDOWS\inf\xusb22.inf
Legacy BusType           : PNPBus
Class                    : XnaComposite
Class GUID               : {d61ca365-5af4-4486-998b-9db4734c6ca3}
Interface GUID           : {a5dcbf10-6530-11d2-901f-00c04fb951ed} (GUID_DEVINTERFACE_USB_DEVICE)
Service                  : xusb22
Enumerator               : USB
Location Info            : Port_#0002.Hub_#0004
Location IDs             : PCIROOT(0)#PCI(1D00)#USBROOT(0)#USB(1)#USB(2), ACPI(_SB_)#ACPI(PCI0)#ACPI(EHC1)#ACPI(RHUB)#ACPI(PRT0)#ACPI(HPT1)
Container ID             : {e1308b1b-2019-5856-9146-beb94d91a2e7}
Manufacturer Info        : Microsoft
Capabilities             : 0x94 (Removable, UniqueID, SurpriseRemovalOK)
Status                   : 0x0180600A (DN_DRIVER_LOADED, DN_STARTED, DN_DISABLEABLE, DN_REMOVABLE, DN_NT_ENUMERATOR, DN_NT_DRIVER)
Problem Code             : 0
Power State              : D0 (supported: D0, D1, D2, D3, wake from D0, wake from D1, wake from D2)
 Child Device 1          : USB Input Device
  Device ID              : USB\VID_15E4&PID_3F00&IG_00\7&38D227C&0&00
  Class                  : HIDClass
   Child Device 1        : HID-compliant game controller
    Device ID            : HID\VID_15E4&PID_3F00&IG_00\8&1FEAF3AD&0&0000
    Class                : HIDClass

        ---------------- Connection Information ---------------
Connection Index         : 0x02 (2)
Connection Status        : 0x01 (DeviceConnected)
Current Config Value     : 0x01
Device Address           : 0x02 (2)
Is Hub                   : 0x00 (no)
Number Of Open Pipes     : 0x07 (7)
Device Bus Speed         : 0x01 (Full-Speed)
Pipe0ScheduleOffset      : 0x00 (0)
Pipe1ScheduleOffset      : 0x01 (1)
Pipe2ScheduleOffset      : 0x00 (0)
Pipe3ScheduleOffset      : 0x03 (3)
Pipe4ScheduleOffset      : 0x05 (5)
Pipe5ScheduleOffset      : 0x0D (13)
Pipe6ScheduleOffset      : 0x01 (1)

        --------------- Connection Information V2 -------------
Connection Index         : 0x02 (2)
Length                   : 0x10 (16 bytes)
SupportedUsbProtocols    : 0x03
 Usb110                  : 1 (yes)
 Usb200                  : 1 (yes)
 Usb300                  : 0 (no)
 ReservedMBZ             : 0x00
Flags                    : 0x00
 DevIsOpAtSsOrHigher     : 0 (Is not operating at SuperSpeed or higher)
 DevIsSsCapOrHigher      : 0 (Is not SuperSpeed capable or higher)
 DevIsOpAtSsPlusOrHigher : 0 (Is not operating at SuperSpeed汐獵 or higher)
 DevIsSsPlusCapOrHigher  : 0 (Is not SuperSpeed汐獵 capable or higher)
 ReservedMBZ             : 0x00

      -------------------- Device Descriptor --------------------
bLength                  : 0x12 (18 bytes)
bDescriptorType          : 0x01 (Device Descriptor)
bcdUSB                   : 0x200 (USB Version 2.00)
bDeviceClass             : 0xFF (Vendor Specific)
bDeviceSubClass          : 0xFF
bDeviceProtocol          : 0xFF
bMaxPacketSize0          : 0x08 (8 bytes)
idVendor                 : 0x15E4
idProduct                : 0x3F00
bcdDevice                : 0x0100
iManufacturer            : 0x01 (String Descriptor 1)
 Language 0x0409         : "BDA"
iProduct                 : 0x02 (String Descriptor 2)
 Language 0x0409         : "Controller"
iSerialNumber            : 0x03 (String Descriptor 3)
 Language 0x0409         : "3048E1E4"
bNumConfigurations       : 0x01

    ------------------ Configuration Descriptor -------------------
bLength                  : 0x09 (9 bytes)
bDescriptorType          : 0x02 (Configuration Descriptor)
wTotalLength             : 0x0099 (153 bytes)
bNumInterfaces           : 0x04
bConfigurationValue      : 0x01
iConfiguration           : 0x00 (No String Descriptor)
bmAttributes             : 0xA0
 D7: Reserved, set 1     : 0x01
 D6: Self Powered        : 0x00 (no)
 D5: Remote Wakeup       : 0x01 (yes)
 D4..0: Reserved, set 0  : 0x00
MaxPower                 : 0xFA (500 mA)

        ---------------- Interface Descriptor -----------------
bLength                  : 0x09 (9 bytes)
bDescriptorType          : 0x04 (Interface Descriptor)
bInterfaceNumber         : 0x00
bAlternateSetting        : 0x00
bNumEndpoints            : 0x02 (2 Endpoints)
bInterfaceClass          : 0xFF (Vendor Specific)
bInterfaceSubClass       : 0x5D
bInterfaceProtocol       : 0x01
iInterface               : 0x00 (No String Descriptor)

        ----------------- Unknown Descriptor ------------------
bLength                  : 0x11 (17 bytes)
bDescriptorType          : 0x21
Data (HexDump)           : 11 21 10 01 01 25 81 14 03 03 03 04 13 02 08 03 
                           03 

        ----------------- Endpoint Descriptor -----------------
bLength                  : 0x07 (7 bytes)
bDescriptorType          : 0x05 (Endpoint Descriptor)
bEndpointAddress         : 0x81 (Direction=IN EndpointID=1)
bmAttributes             : 0x03 (TransferType=Interrupt)
wMaxPacketSize           : 0x0020 (32 bytes)
bInterval                : 0x04 (4 ms)

        ----------------- Endpoint Descriptor -----------------
bLength                  : 0x07 (7 bytes)
bDescriptorType          : 0x05 (Endpoint Descriptor)
bEndpointAddress         : 0x02 (Direction=OUT EndpointID=2)
bmAttributes             : 0x03 (TransferType=Interrupt)
wMaxPacketSize           : 0x0020 (32 bytes)
bInterval                : 0x08 (8 ms)

        ---------------- Interface Descriptor -----------------
bLength                  : 0x09 (9 bytes)
bDescriptorType          : 0x04 (Interface Descriptor)
bInterfaceNumber         : 0x01
bAlternateSetting        : 0x00
bNumEndpoints            : 0x04 (4 Endpoints)
bInterfaceClass          : 0xFF (Vendor Specific)
bInterfaceSubClass       : 0x5D
bInterfaceProtocol       : 0x03
iInterface               : 0x00 (No String Descriptor)

        ----------------- Unknown Descriptor ------------------
bLength                  : 0x1B (27 bytes)
bDescriptorType          : 0x21
Data (HexDump)           : 1B 21 10 01 01 01 83 40 01 04 20 16 85 00 00 00 
                           00 00 00 16 05 00 00 00 00 00 00 

        ----------------- Endpoint Descriptor -----------------
bLength                  : 0x07 (7 bytes)
bDescriptorType          : 0x05 (Endpoint Descriptor)
bEndpointAddress         : 0x83 (Direction=IN EndpointID=3)
bmAttributes             : 0x03 (TransferType=Interrupt)
wMaxPacketSize           : 0x0020 (32 bytes)
bInterval                : 0x02 (2 ms)

        ----------------- Endpoint Descriptor -----------------
bLength                  : 0x07 (7 bytes)
bDescriptorType          : 0x05 (Endpoint Descriptor)
bEndpointAddress         : 0x04 (Direction=OUT EndpointID=4)
bmAttributes             : 0x03 (TransferType=Interrupt)
wMaxPacketSize           : 0x0020 (32 bytes)
bInterval                : 0x04 (4 ms)

        ----------------- Endpoint Descriptor -----------------
bLength                  : 0x07 (7 bytes)
bDescriptorType          : 0x05 (Endpoint Descriptor)
bEndpointAddress         : 0x85 (Direction=IN EndpointID=5)
bmAttributes             : 0x03 (TransferType=Interrupt)
wMaxPacketSize           : 0x0020 (32 bytes)
bInterval                : 0x40 (64 ms)

        ----------------- Endpoint Descriptor -----------------
bLength                  : 0x07 (7 bytes)
bDescriptorType          : 0x05 (Endpoint Descriptor)
bEndpointAddress         : 0x05 (Direction=OUT EndpointID=5)
bmAttributes             : 0x03 (TransferType=Interrupt)
wMaxPacketSize           : 0x0020 (32 bytes)
bInterval                : 0x10 (16 ms)

        ---------------- Interface Descriptor -----------------
bLength                  : 0x09 (9 bytes)
bDescriptorType          : 0x04 (Interface Descriptor)
bInterfaceNumber         : 0x02
bAlternateSetting        : 0x00
bNumEndpoints            : 0x01 (1 Endpoint)
bInterfaceClass          : 0xFF (Vendor Specific)
bInterfaceSubClass       : 0x5D
bInterfaceProtocol       : 0x02
iInterface               : 0x00 (No String Descriptor)

        ----------------- Unknown Descriptor ------------------
bLength                  : 0x09 (9 bytes)
bDescriptorType          : 0x21
Data (HexDump)           : 09 21 10 01 01 22 86 07 00 

        ----------------- Endpoint Descriptor -----------------
bLength                  : 0x07 (7 bytes)
bDescriptorType          : 0x05 (Endpoint Descriptor)
bEndpointAddress         : 0x86 (Direction=IN EndpointID=6)
bmAttributes             : 0x03 (TransferType=Interrupt)
wMaxPacketSize           : 0x0020 (32 bytes)
bInterval                : 0x10 (16 ms)

        ---------------- Interface Descriptor -----------------
bLength                  : 0x09 (9 bytes)
bDescriptorType          : 0x04 (Interface Descriptor)
bInterfaceNumber         : 0x03
bAlternateSetting        : 0x00
bNumEndpoints            : 0x00 (Default Control Pipe only)
bInterfaceClass          : 0xFF (Vendor Specific)
bInterfaceSubClass       : 0xFD
bInterfaceProtocol       : 0x13
iInterface               : 0x04 (String Descriptor 4)
 Language 0x0409         : "Xbox Security Method 3, Version 1.00, © 2005 Microsoft Corporation. All rights reserved."

        ----------------- Unknown Descriptor ------------------
bLength                  : 0x06 (6 bytes)
bDescriptorType          : 0x41
Data (HexDump)           : 06 41 00 01 01 03 

      -------------------- String Descriptors -------------------
             ------ String Descriptor 0 ------
bLength                  : 0x04 (4 bytes)
bDescriptorType          : 0x03 (String Descriptor)
Language ID[0]           : 0x0409 (English - United States)
             ------ String Descriptor 1 ------
bLength                  : 0x08 (8 bytes)
bDescriptorType          : 0x03 (String Descriptor)
Language 0x0409          : "BDA"
             ------ String Descriptor 2 ------
bLength                  : 0x16 (22 bytes)
bDescriptorType          : 0x03 (String Descriptor)
Language 0x0409          : "Controller"
             ------ String Descriptor 3 ------
bLength                  : 0x12 (18 bytes)
bDescriptorType          : 0x03 (String Descriptor)
Language 0x0409          : "3048E1E4"
             ------ String Descriptor 4 ------
bLength                  : 0xB2 (178 bytes)
bDescriptorType          : 0x03 (String Descriptor)
Language 0x0409          : "Xbox Security Method 3, Version 1.00, © 2005 Microsoft Corporation. All rights reserved."
             -- MSFT String Descriptor 0xEE --
bLength                  : 0x12 (18 bytes)
bDescriptorType          : 0x03 (String Descriptor)
qwSignature Lang 0x0409  : "MSFT100"
bMS_VendorCode           : 0x90
bPad                     : 0x00
